,docname,from,to,pre,keyword,post,pattern
73,output.txt,104432,104432,"to participate in debt suspension for developing countries.third , we should promote just and equitable global economic governance . it is vital to practice true",multilateralism,", safeguard the international order underpinned by international law , protect the wto-centered multilateral trading system , and ensure stable and smooth industrial and supply",multilateralism
74,output.txt,105649,105649,"territorial integrity and national dignity . our two sides should jointly uphold the principle of non-interference in other countries ' internal affairs , practice true",multilateralism,", and defend the legitimate rights and interests of developing countries . - we should focus on economic development and promote win-win cooperation . we",multilateralism
75,output.txt,106790,106790,"other's sovereignty and independence , respected each other's development paths , upheld equality between countries regardless of their size , and stood firm in defending",multilateralism,". the leapfrog growth is attributed to the high degree of complementarity . china has a vast consumer market and a complete industrial system ,",multilateralism
76,output.txt,107079,107079,"mutual trust and firmly support each other's core interests . we need to jointly uphold the principle of non-interference in internal affairs , practice true",multilateralism,", and defend the common interests of all developing countries . - we should be partners for common development . we need to better synergize",multilateralism
77,output.txt,119692,119692,"economy is a pressing task for all countries . china is ready to work with all parties to uphold the un-centered international system , practice",multilateralism,", promote the implementation of the global security initiative ( gsi ) and jointly safeguard world peace and tranquility . china calls for a joint",multilateralism
78,output.txt,122979,122979,"are entrusted to us by the people.faced with the volatile international landscape and the treacherous global economic situation , we need to stay committed to",multilateralism,"and economic globalization , which represents the way forward.we need to strengthen complementarity between our development strategies , earnestly implement the rcep , drive our",multilateralism
79,output.txt,124980,124980,"the path is unfolding before us , and a brighter future beckons beyond . china is ready to work with all countries to practice true",multilateralism,", build more consensus for openness , jointly overcome the difficulties and challenges confronting global economic growth , and make sure that our commitment to",multilateralism
80,output.txt,125651,125651,"and rising sea levels , so as to look after this blue home that we share.third , jointly discuss ocean governance.we need to uphold true",multilateralism,. further efforts should be made to improve the governance system centered around the united nations . the national conditions unique to different countries should,multilateralism
81,output.txt,128322,128322,"each other in following a development path suited to our own national conditions . we need to uphold the un-centered international system , champion true",multilateralism,", and oppose hegemonism and power politics , to preserve the fundamental and long-term interests of asian countries.china has all along viewed cica's development from",multilateralism
82,output.txt,130816,130816,"no country is above others , and no country should abuse its power to bully other sovereign countries . we should promote and practice true",multilateralism,", promote equality of all countries in terms of rights , rules and opportunities , and build a new type of international relations featuring mutual",multilateralism
83,output.txt,141469,141469,guide that the sco must continue to follow in the years to come . the commitment to these five points is a practice of true,multilateralism,that rises above traditional bloc politics . it is an answer to the question of what new type of regional cooperation is required in the,multilateralism
84,output.txt,141631,141631,"emphasizing that we need to enhance mutual support , expand security cooperation , deepen practical cooperation , enhance people-to-people and cultural exchanges , and uphold",multilateralism,". these suggestions echo the common aspirations of every member state to seek unity , stability and development , and draw a road map for",multilateralism
85,output.txt,145201,145201,"firm in safeguarding the un-centered international system and the international order based on international law , practice the common values of humanity , uphold true",multilateralism,", jointly improve global governance , reject zero-sum game and bloc politics , and work together to ensure that the international order is more just",multilateralism
86,output.txt,147155,147155,"will carry out 2,000 free cataract operations for sco member states and provide 5,000 human resources training opportunities for them.fifth , we need to uphold",multilateralism,. obsession with forming a small circle can only push the world toward division and confrontation . we should remain firm in safeguarding the un-centered,multilateralism
87,output.txt,147228,147228,"bloc politics . we should expand sco's exchanges with other international and regional organizations such as the un , so as to jointly uphold true",multilateralism,", improve global governance , and ensure that the international order is more just and equitable.colleagues , the eurasian continent is home to us all",multilateralism
88,output.txt,153064,153064,"it's important to implement the gsi , stay committed to the vision of common , comprehensive , cooperative and sustainable security , act on true",multilateralism,", and contribute our strengths to maintaining peace and tranquility in the region and the world at large . an old chinese saying goes ,",multilateralism
89,output.txt,155500,155500,"become a pillar force in defending the legitimate rights and interests of developing countries , upholding the purposes of the un charter , and advocating",multilateralism,"and international fairness and justice . - together , we have kept our focus on development cooperation . we have pushed forward our cooperation on",multilateralism
90,output.txt,156593,156593,"successful high-level meeting of the non-aligned movement . we will work with africa to carry forward the five principles of peaceful co-existence , practice true",multilateralism,"and jointly safeguard the legitimate rights and interests of developing countries.second , we need to take concrete actions to promote common development . china keeps",multilateralism
91,output.txt,163393,163393,"world today is not peaceful , and there are two completely different trends concerning the future of asia . one advocates open regionalism , true",multilateralism,", a development-first approach and mutually beneficial cooperation ; it aims to help countries in the region emerge from the pandemic and achieve all-round development",multilateralism
92,output.txt,165859,165859,asian vitalization ! thank you . remarks by h.e . wang yistate councilor and foreign minister ofthe people's republic of chinaat session 1 - strengthening,multilateralism,"ofthe g20 foreign ministers ' meetingbali , 8 july 2022your excellency foreign minister retno marsudi , colleagues , it is such a pleasure to attend",multilateralism
93,output.txt,166006,166006,"global financial crisis . the declaration of the first summit clearly states that "" we are confident that through continued partnership , cooperation , and",multilateralism,", we will overcome the challenges before us . "" given the current circumstances , it is imperative that we revisit this original purpose and",multilateralism
94,output.txt,166038,166038,"before us . "" given the current circumstances , it is imperative that we revisit this original purpose and work as cooperation partners for true",multilateralism,". - we should be partners of mutual respect and equal consultation . international affairs should be handled by all countries through consultation , and",multilateralism
95,output.txt,166133,166133,", the international order underpinned by international law . imposing the rules made by a certain country or group on others is the antithesis of",multilateralism,. - we should be partners of peaceful coexistence and win-win cooperation . one can only ensure its own security when it takes others ',multilateralism
96,output.txt,166349,166349,"china hopes to work with all other g20 members to overcome differences with solidarity , replace confrontation with cooperation , and translate the spirit of",multilateralism,"into concrete actions for safeguarding world peace and promoting common development . - we hope to work with all sides to facilitate talks , and",multilateralism
97,output.txt,166667,166667,", infrastructure , and green development.china recently hosted the brics summit and the high-level dialogue on global development , which produced broad consensus on supporting",multilateralism,"and implementing the 2030 agenda for sustainable development . committed to the vision of a community with a shared future for mankind , we will",multilateralism
98,output.txt,168211,168211,"the world will witness even more turbulence and insecurity.it is important that brics countries support each other on issues concerning core interests , practice true",multilateralism,", safeguard justice , fairness and solidarity and reject hegemony , bullying and division . this year , we have held the foreign ministers '",multilateralism
