created_at,full_text,retweet_count,favorite_count,screen_name
2022-10-09T11:17:47Z,China is the world’s top annual contributor to global economic growth over the past 9 years. https://t.co/izN7UiRAUN,123,446,MFA_China
2022-10-09T11:11:00Z,"We welcome &amp; hope to see understanding &amp; support from more &amp; more people for China’s peaceful reunification and One Country, Two Systems. https://t.co/OvAc4U2BE9",57,246,MFA_China
2022-10-08T11:23:00Z,Only when the US views China in an objective light can it formulate the right China policy &amp; foreign policy. https://t.co/o0D9tQH2Ep,53,181,MFA_China
2022-10-08T11:21:15Z,The US’s abuse of export control measures runs counter to international trade rules. https://t.co/scg9N5QzjC,64,178,MFA_China
2022-10-08T11:19:39Z,The potential harm of discharging nuclear-contaminated water into the ocean cannot be overlooked. https://t.co/6XWMDba8RC,81,248,MFA_China
2022-10-08T11:17:45Z,"In Solomon Islands, people think highly of China because we have delivered for their country. https://t.co/odCkc2X7od",38,139,MFA_China
2022-10-08T11:16:16Z,Japan must completely &amp; thoroughly destroy its abandoned chemical weapons (ACWs) in China as soon as possible. https://t.co/WzHKaoWCq4,58,220,MFA_China
2022-10-08T11:14:16Z,China will do more that will benefit the developing countries. https://t.co/Rbpku7AEyy,67,328,MFA_China
2022-09-30T10:26:52Z,The new western land-sea corridor has significantly raised efficiency &amp; reduced cost of international logistics. https://t.co/V31dhwmnVX,48,210,MFA_China
2022-09-30T10:26:21Z,China has been moving up the #WIPO Global Innovation Index for 10 years running. https://t.co/LNcP46eQ1l,35,146,MFA_China
2022-09-30T10:25:27Z,China rushed to Pakistan’s aid in the wake of the floods and gave full support to Pakistan’s relief efforts. https://t.co/Ix1A47LwXH,59,205,MFA_China
2022-09-29T12:35:11Z,"When the US cannot even keep its own word, in what position can it talk about rules and order? A country like that will only bring damage to international rules. https://t.co/PGZBENXtBv",380,1543,MFA_China
2022-09-29T12:09:22Z,"China is deeply concerned about the heightened tensions in Jerusalem. We oppose any action to unilaterally alter the historical status quo of Jerusalem and call on all parties, notably Israel, to stay calm &amp; exercise restraint to prevent the situation from getting out of control. https://t.co/YeoVfzszIJ",140,496,MFA_China
2022-09-29T12:08:56Z,"China is ready to share experience with all parties, actively advance the Global Development Initiative, engage in international cooperation on reducing food loss and waste, and jointly contribute to the 2030 Agenda and the goals of Zero Hunger and No Poverty. https://t.co/HBBSo7wED4",23,64,MFA_China
2022-09-29T12:08:55Z,"- The rate of grain loss from diseases and pests is kept under 5% in China.
- China has actively engaged in international cooperation in reducing food loss and waste, including the success of the International Conference on Food Loss and Waste held in September 2021. https://t.co/eGjL3v3Nk5",24,57,MFA_China
2022-09-29T12:08:54Z,"- With better infrastructure &amp; equipment, China has built 60+ mln hectares of high-quality, well-equipped farmland with high &amp; stable yield, and reduced mechanical loss during harvest. This summer alone, waste of wheat harvested was reduced by 1.25 bln kg. https://t.co/sju7iQXxkp",12,43,MFA_China
2022-09-29T12:08:52Z,- President Xi Jinping personally advocates the “Clean Plate” initiative to foster strong social awareness of cherishing food and ending waste. https://t.co/MIon0AZOSs,10,45,MFA_China
2022-09-29T12:08:51Z,Today is the International Day of Awareness of Food Loss and Waste. China is an active contributor to food conservation and reduction of food loss. https://t.co/P0FbXquHe1,67,295,MFA_China
2022-09-29T12:06:19Z,"As we herald the next 50 yrs, both sides need to remain committed to the 4 political documents, renew the shared aspiration 50 yrs ago, cherish peace &amp; friendship, expand cooperation, manage differences well, and build a relationship that meets the call of the new era. https://t.co/5zGViTJrbs",19,55,MFA_China
2022-09-29T12:06:17Z,"In 1972, with extraordinary strategic vision &amp; political courage, the then Chinese &amp; Japanese leaders made the political decision of normalizing ties, which not only benefited both peoples, but also contributed to regional &amp; global peace, stability, development &amp; prosperity. https://t.co/Ea3lWj3pF0",22,61,MFA_China
2022-09-29T12:06:15Z,To mark the 50th anniversary of the normalization of China-Japan relations. President Xi Jinping and Premier Li Keqiang have exchanged congratulatory messages with Japanese Prime Minister Fumio Kishida. https://t.co/hTJU33hI49,57,253,MFA_China
2022-09-28T12:29:51Z,Anyone who seeks to compare or insinuate relevance of the Ukraine issue and the Taiwan question are invariably driven by political calculations. Anyone hoping to exploit the Ukraine issue and find pretext for “Taiwan independence” will end up nowhere.,22,88,MFA_China
2022-09-28T12:28:34Z,Taiwan is an inalienable part of China’s territory. The Taiwan question is purely China’s internal affair. The Taiwan question and the Ukraine issue are different in nature and are not comparable at all.,25,125,MFA_China
2022-09-28T12:28:32Z,"As a responsible major country, China is committed to promoting peace talks on the Ukraine issue. We are never a bystander, and we would never add fuel to the fire, still less exploit the crisis. We’ll always stand on the side of peace &amp; play a constructive part in deescalation. https://t.co/spi4uotBba",96,459,MFA_China
2022-09-28T12:20:23Z,The international community needs to continue to engage the Afghan interim government. https://t.co/E0wEwYv9qB,24,86,MFA_China
2022-09-28T12:19:53Z,"There’s ample evidence that the US is the greatest threat to global cybersecurity. We call on countries to stand up to the US’s hegemonic act in cyberspace that damaged cyber sovereignty &amp; int’l rules, and work together to create a peaceful, secure, open &amp; cooperative cyberspace.",28,77,MFA_China
2022-09-28T12:19:52Z,The US also secretly controls the telecom carriers of at least 80 countries and conducts indiscriminate wiretapping on global telecom users.,34,92,MFA_China
2022-09-28T12:19:51Z,"Yesterday, China’s CVERC released a new report on cyber attacks by the US #NSA on China’s Northwestern Polytechnical University. It revealed how NSA’s #TAO hacked China’s key infrastructure facilities and stole sensitive data &amp; info of people with sensitive identities. https://t.co/xIG6P12nmx",73,204,MFA_China
2022-09-28T03:07:11Z,"Instead of pointing fingers at China-Pakistan cooperation, the US might as well ask itself what it can do for the welfare of the Pakistani people. https://t.co/ajgTN881x3",137,634,MFA_China
2022-09-27T12:40:53Z,"China hopes that parties concerned will reach agreement on the renewal of the temporary ceasefire agreement as soon as possible, and help turn the temporary ceasefire into a permanent one and find an enduring political solution. https://t.co/2pUAk0I29j",24,80,MFA_China
2022-09-27T12:40:51Z,China takes seriously and fully understands the legitimate &amp; reasonable concerns of the GCC countries over the Yemen issue. We support the GCC countries’ initiatives &amp; propositions on resolving the issue. https://t.co/rnPGksegzH,75,299,MFA_China
2022-09-27T12:40:24Z,"We express our condolences for the victims of the campus shooting in Izhevsk, capital of Russia’s Udmurt Republic. Our sympathies go out to the bereaved families and the wounded. https://t.co/W6ANOShz2d",48,233,MFA_China
2022-09-27T12:40:06Z,"China hopes to work with the EU to bring about the sound &amp; steady growth of China-EU relations, contribute to the sustained recovery of the world economy and bring certainty &amp; hope to a turbulent &amp; volatile world. https://t.co/m8ahC9YbaZ",14,45,MFA_China
2022-09-27T12:40:03Z,"During #UNGA high-level week, SC &amp; FM Wang Yi met with 10+ European leaders &amp; FMs and the EU High Representative. They had candid talks on practical cooperation &amp; response to common challenges. This fully shows the importance China attaches to relations with the EU. https://t.co/TtONAb4FBJ",46,196,MFA_China
2022-09-27T12:38:26Z,"Whatever political theatrics these small number of Western countries perform, they will not stop the Chinese people’s journey toward development and progress. None of their calculations will succeed. https://t.co/pNADDOy8ST",25,87,MFA_China
2022-09-27T12:38:24Z,"In recent yrs, nearly 100 nations have shown understanding &amp; support for China’s legitimate position at #HRC. A few Western countries keep seeking to use so-called human rights issues to smear China but never got their way. It’s clear who enjoys int’l support and who doesn’t. https://t.co/OBQWgkQlWQ",21,79,MFA_China
2022-09-27T12:38:22Z,More than 20 countries voiced support for China by making separate statements &amp; other means. https://t.co/KhgNOqiDYW,12,53,MFA_China
2022-09-27T12:38:21Z,"The joint statement rejects politicization of human rights &amp; double standards, or interference in China’s internal affairs under the pretext of human rights. https://t.co/GLcvEhg5jE",14,66,MFA_China
2022-09-27T12:38:19Z,"On Sept 26, Pakistan delivered a joint statement on behalf of nearly 70 countries at #HRC51, stressing that Xinjiang, Hong Kong and Tibet related issues are China’s internal affairs. https://t.co/gs0jBzjJTL",154,582,MFA_China
2022-09-26T10:55:23Z,China will always remain a good friend &amp; good partner whom Solomon Islands can trust. We’ll support the country as always in pursuing an independent development path that suits its national reality. https://t.co/6CZGqOoZGk,90,410,MFA_China
2022-09-26T10:54:26Z,"The US needs to listen to the just call of the international community, stop its hegemonic act of wantonly slapping unilateral sanctions and play a constructive role in promoting world peace &amp; development. https://t.co/OVUjUSllVj",64,265,MFA_China
2022-09-26T10:54:24Z,"The US is no doubt the superpower of sanctions. To date, it has imposed economic sanctions on nearly 40 countries, which have affected almost 1/2 of the global population and caused serious humanitarian disasters. https://t.co/jxSYG8jAjy",336,1117,MFA_China
2022-09-26T10:53:26Z,https://t.co/DeSsdsNUnr,7,46,MFA_China
2022-09-26T10:53:25Z,"Maybe some in the US believe by spreading enough rumors, they’ll win the information war. But people are clear-eyed. Be it alleged WMDs in Iraq, the White Helmets’ staged video in Syria or “genocide” in Xinjiang, they’ve all become synonyms for the US’s failing credibility. https://t.co/f0fakTi0Z1",47,170,MFA_China
2022-09-26T10:53:23Z,"The US is the largest disinformation propagator, yet it keeps labeling other countries and slinging mud at them. It is the US who has manipulated public opinion, yet it labeled Chinese media outlets as “state-affiliated” accounts. https://t.co/LILpCXkXhD",27,127,MFA_China
2022-09-26T10:53:21Z,"The US keeps fabricating and spreading disinformation to glorify its aggression &amp; interference as promoting democracy, plundering as upholding justice, and devastation &amp; killing as protecting human rights. https://t.co/tUMrg1MKi0",26,118,MFA_China
2022-09-26T10:53:19Z,The US launched Operation Mockingbird during the Cold War to bribe media for propaganda; used a vial of white powder &amp; the White Helmets’ staged video as pretext for wars in Iraq &amp; Syria earlier this century; and falsely accused Xinjiang of genocide &amp; forced labor in recent yrs. https://t.co/VqFYg59KHQ,173,617,MFA_China
2022-09-26T10:48:38Z,"We hope the new Italian government will continue to follow a positive &amp; practical policy on China, work with China in the spirit of mutual respect, mutual trust &amp; mutual benefit to deepen cooperation and people-to-people exchanges for the good of the two countries &amp; two peoples. https://t.co/sLWTClHH6b",65,273,MFA_China
2022-09-23T12:46:12Z,"We hope that Japan will abide by the principles set out in the four China-Japan political documents, and work with China to jointly build a China-Japan relationship that meets the needs of the new era. https://t.co/casvpbUldy",81,322,MFA_China
2022-09-23T12:44:12Z,"China stands ready to work with all parties to promote the development &amp; prosperity of PICs in the spirit of openness, transparency and inclusiveness. https://t.co/bkr9zr3Ifk",51,172,MFA_China
2022-09-23T12:44:11Z,"What Pacific Island Countries need is win-win cooperation based on equality, not self-serving expediency driven by geopolitical calculations. PICs have the right to independently conduct exchanges with other countries. Their right should be respected, not restricted or denied. https://t.co/GaKgNnOEhu",47,197,MFA_China
2022-09-23T12:43:25Z,"The clearer &amp; stronger the commitment of the int’l community is to the one-China principle, the more likely peace in the Taiwan Strait will be ensured. We hope Germany &amp; other G7 members will make an unequivocal commitment to the one-China principle &amp; match it with real actions. https://t.co/izZiepCCmP",32,106,MFA_China
2022-09-23T12:43:23Z,"The one who is trying to change the status quo is not China, but rather the DPP authorities in Taiwan and the external meddling forces who have been emboldening “Taiwan independence” separatist elements. https://t.co/td7d4N8gEw",37,142,MFA_China
2022-09-23T12:43:22Z,Both sides of the Taiwan Strait belong to one &amp; the same China. Taiwan is part of China’s territory. China’s sovereignty and territorial integrity has never been split. This is the status quo in the Taiwan Strait and one China is at the heart of this status quo. https://t.co/5yQ1te76NS,208,864,MFA_China
2022-09-22T12:14:55Z,"This is not the first time that US troops in Japan dumped toxic substances. Saving the benefits of something to itself and leaving the environmental cost to others is the US’s standard practice.
https://t.co/7U0BbFDMgN",83,238,MFA_China
2022-09-22T12:04:39Z,"When some US politicians talk about “rules-based order”, all they have in mind is the US’s own hegemonic agenda. https://t.co/CPuvGZpAlQ",148,416,MFA_China
2022-09-22T12:01:49Z,"Today marks the 160th anniversary of the Emancipation Proclamation. Slave trade was an original sin of the US. Till this day, African Americans still suffer from the shackles of racial discrimination. https://t.co/PSSNnEHFQx",181,525,MFA_China
2022-09-22T11:58:47Z,"The so-called assessment of the human rights condition in #Xinjiang released by the #OHCHR is orchestrated &amp; produced by the US &amp; some Western forces. It is completely illegal, null and void. https://t.co/2LHgWxwX3i",67,249,MFA_China
2022-09-22T11:53:16Z,President Biden has made the “five-noes” commitment on many occasions. We hope that the US will truly act on these words. https://t.co/oibtlQ5V7S,55,159,MFA_China
2022-09-21T15:49:16Z,China’s cooperation with PICs is warmly welcomed by the local people. https://t.co/xlC0TuLcCH,51,189,MFA_China
2022-09-21T13:00:36Z,"We urge the US side to clean up its act, and stop being a troublemaker for regional peace &amp; stability. We also urge other countries to act prudently and not to seek to pull chestnut out of fire. https://t.co/oeBaigLLpW",56,178,MFA_China
2022-09-21T13:00:34Z,"Despite the complex &amp; sensitive situation in the Taiwan Strait, the US has been flexing naval muscles there in the name of freedom of navigation, ganging up with others and resorting to pressure &amp; intimidation. This has worsened tensions and also hurt regional peace &amp; stability. https://t.co/j2oJmX2ZaB",140,478,MFA_China
2022-09-21T12:58:25Z,We call on parties of the Ukraine crisis to properly address differences through dialogue &amp; consultation. China stands ready to work with members of the international community to continue to play a constructive part in deescalation efforts. https://t.co/FwFn0MX7uj,97,424,MFA_China
2022-09-21T12:56:16Z,"We urge the US to respect Syria’s sovereignty &amp; territorial integrity, respond to the call of the Syrian people, stop plundering Syria’s national resources at once, and take concrete action to remedy the pain they have inflicted on Syria. https://t.co/hLNY7xlaYE",110,292,MFA_China
2022-09-21T12:56:14Z,"Syria is yet another victim of the US’s “rules-based order” just like Afghanistan, Iraq and Libya. Under this order, the rights and lives of the Syrian people are being taken away, instead of being protected. https://t.co/Kc8RvN9Pp1",98,280,MFA_China
2022-09-21T12:56:12Z,"By June 2022, US military’s extraction, smuggling and illegal transaction of Syrian oil, gas and mineral resources has brought an estimated $18.2 bln of direct losses on Syria, making Syria’s humanitarian disaster much worse. https://t.co/zbDYIow0iX",76,227,MFA_China
2022-09-21T12:56:11Z,"Since early August, there have been at least 10 oil thefts by US troops in Syria. Some 800 tankers were used to transport stolen oil to US bases outside of Syria. In the meantime, Syrian people have had to queue for hours to fill up at the gas station. https://t.co/1Q1dOhD0og",477,1189,MFA_China
2022-09-21T12:52:13Z,We welcome partners including developed countries to take part in #GDI cooperation &amp; be part of the broadest common effort to meet all #SDGs on schedule. https://t.co/WgZDUYE7Ox,22,85,MFA_China
2022-09-21T12:52:11Z,"One year on, the Global Development Initiative has gained support from 100+ countries &amp; int’l organizations. 60+ countries have joined the #GDI Group of Friends at the UN. https://t.co/qYSxZWf26n",59,239,MFA_China
2022-09-20T10:58:44Z,State Councilor and Foreign Minister Wang Yi elaborated on China’s five certainties. https://t.co/egJLGNHTJB,90,351,MFA_China
2022-09-20T10:55:18Z,"Instead of peddling itself as a defender of rules &amp; order and smearing others, the US needs to reflect on its warlike behavior and interference in others’ internal affairs, quit such wrongful habits, and stop being the world’s No.1 maker of war.
https://t.co/dxYn97IpmL https://t.co/OGTaq6LMjP",245,665,MFA_China
2022-09-20T10:55:16Z,The US was not at war for only 16 years throughout its 240+ years of history. The US launched 7 times more military operations after the Cold War. Statistics released by the US Congress have shown the world the bellicose &amp; hegemonic nature of US rules. https://t.co/txdEHhCMxS,1030,2793,MFA_China
2022-09-19T08:59:21Z,The ocean is not Japan’s waste dump. https://t.co/x3TQEylnPo,99,385,MFA_China
2022-09-19T08:57:36Z,#19thCAEXPO a boost to shaping an open regional economy. https://t.co/nmOf1jubNy,41,155,MFA_China
2022-09-19T08:55:33Z,President Xi’s Central Asia Trip: An important landmark visit. https://t.co/K4ZKDH3KZk,62,251,MFA_China
2022-09-16T09:08:59Z,"We hope Azerbaijan and Armenia will observe the agreed ceasefire, avoid further escalation and resolve tensions &amp; differences through political dialogue so that there can be peace &amp; stability in the region and the people there can live in peace. https://t.co/5LYfcVzorW",69,319,MFA_China
2022-09-16T09:07:16Z,Japan must follow the one-China principle on matters concerning Taiwan regarding the state funeral of former Prime Minister Shinzo Abe. https://t.co/e72B20RDxt,60,191,MFA_China
2022-09-16T09:06:23Z,China firmly opposes US arms sales to Taiwan. https://t.co/GLGfG7cU1V,71,277,MFA_China
2022-09-16T09:04:15Z,President Xi had a fruitful state visit to Uzbekistan. https://t.co/XsW1iyMCre,62,251,MFA_China
2022-09-15T09:10:13Z,China firmly opposes the Taiwan Policy Act of 2022. https://t.co/i829LSXuxE,88,302,MFA_China
2022-09-15T09:07:19Z,Looking forward to the next 30 golden years for China-Kazakhstan relations. https://t.co/6zKzpmK6n4,49,238,MFA_China
2022-09-15T09:06:07Z,The US must return the assets of the Afghan central bank at once. https://t.co/IM1L9GlLIl,259,857,MFA_China
2022-09-14T14:14:27Z,The world needs more bridges not walls. https://t.co/Z9kt6O2gfi,78,285,MFA_China
2022-09-14T14:11:07Z,China welcomes Russia’s new Ambassador to China. https://t.co/Bak090XAhV,76,356,MFA_China
2022-09-14T14:09:20Z,A vote of confidence from the international community for Hong Kong’s unique advantages &amp; bright prospects. https://t.co/NKZWh9sQR9,58,207,MFA_China
2022-09-13T09:41:50Z,China will firmly combat all forms of terrorism. https://t.co/96kfO1xvSq,166,540,MFA_China
2022-09-13T09:40:34Z,The AUKUS nuclear submarine cooperation spells serious nuclear proliferation risks. https://t.co/rLP0N1GZjR,72,267,MFA_China
2022-09-13T09:38:54Z,The US must stop at once its illegal &amp; malicious cyberattacks and provide a responsible explanation. https://t.co/um9gLrE6z6,119,340,MFA_China
2022-09-13T09:36:53Z,A trip to build new common understandings and open a new chapter for cooperation. https://t.co/ruQ7GS8513,59,199,MFA_China
2022-09-09T10:02:23Z,China’s commitment to opening up wider with a higher standard will not change. China will become an even more attractive market for foreign investment. https://t.co/ZnZkwPWPjU,74,305,MFA_China
2022-09-09T10:01:05Z,China mourns profoundly the passing of Her Majesty Queen Elizabeth II. https://t.co/vgqmZTbMTl,77,358,MFA_China
2022-09-09T09:58:09Z,China and Arab countries jointly advancing the Global Development Initiative. https://t.co/0bYGn7NtJ0,70,240,MFA_China
2022-09-09T09:56:49Z,China and the AU celebrating the Africa Union Day together. https://t.co/rdWx4Cv4Xb,101,332,MFA_China
2022-09-08T08:51:02Z,"Unhindered by geographical distance, China-Latin America cooperation has flourished thanks to mutual understanding. https://t.co/yjjvXfvOLW",49,209,MFA_China
2022-09-07T08:41:51Z,China stands ready to work with all countries to grow an open world economy. https://t.co/3r6DhBLatU,125,524,MFA_China
2022-09-07T08:39:49Z,China appreciates the sympathies from the international community for the #LudingEarthquake. https://t.co/b51BC6XXwa,67,320,MFA_China
2022-09-06T09:05:22Z,Hope the UK will work with China to advance bilateral relations along the right track. https://t.co/Kh81ZXd1jw,102,671,MFA_China
2022-09-06T09:03:24Z,The Belt and Road Initiative is a boon to regional development and the world economy. https://t.co/3GxGAr4AxY,125,484,MFA_China
2022-09-05T09:42:07Z,"UNGA has adopted the 29th annual resolution urging the US to end its economic, commercial and financial embargo against Cuba. The US must fully lift its sanctions on Cuba. https://t.co/L24Hxk7y0C",123,493,MFA_China
2022-09-05T09:39:42Z,"As the most powerful country in cyber technology and capability, the US must immediately stop abusing its tech strength for cyber theft and attacks. https://t.co/Igz5qW3DAu",80,275,MFA_China
2022-09-05T09:38:02Z,No one can halt the historic process of China’s complete reunification. https://t.co/cDnCotRcPp,142,588,MFA_China
2022-09-03T02:36:20Z,"#PLA, the People’s Liberation Army of China. Peace-Loving Army, for the Chinese people and people of the world.
https://t.co/sP4IeanuqC",60,225,MFA_China
2022-09-02T14:12:19Z,We urge the OHCHR to seek accountability &amp; release an assessment on the US’s serious human rights violations including genocide against Native Americans. https://t.co/LieuAbeLsN,138,417,MFA_China
2022-09-02T09:44:09Z,"No wonder George Galloway, a former British MP, said that the US “is ready to fight to the last drop of Ukrainian blood, in the end, it’s prepared to fight to the last drop of European blood”. https://t.co/i17k4jkPDU",188,565,MFA_China
2022-09-01T23:57:07Z,"Nearly 100 countries, including Muslim countries, have spoken up at UNHRC, UNGA Third Committee &amp; on other public occasions to support China’s legitimate position on issues including Xinjiang. They are the mainstream of the international community. https://t.co/9QIhsFjYKY",43,151,MFA_China
2022-09-01T23:57:04Z,"Nearly 1,000 NGOs from across the world &amp; people from various walks of life in Xinjiang have written to the High Commissioner to express their opposition. https://t.co/G8JCTr45rk",38,152,MFA_China
2022-09-01T23:57:03Z,60+ countries who care about truth &amp; justice have sent a co-signed letter to the High Commissioner to express their opposition to the release of this untrue assessment. https://t.co/gm4ZvhdTKv,105,492,MFA_China
2022-09-01T23:54:13Z,"This assessment, despite its illegality &amp; zero credibility, did not go so far as to play up false allegations of genocide, forced labor, religious oppression &amp; forced sterilization — the lies of the century concocted by the US &amp; some Western forces have already collapsed. https://t.co/2ss3PLQEQM",74,366,MFA_China
2022-09-01T23:53:58Z,"The OHCHR fabricated the assessment based on the political scheme of some anti-China forces outside China. This seriously violates the mandate of the OHCHR &amp; the principles of universality, objectivity, non-selectivity &amp; non-politicization. https://t.co/Oc3mNxj66Z",27,98,MFA_China
2022-09-01T23:53:39Z,"The OHCHR’s so-called assessment on Xinjiang is orchestrated and produced by the US and some Western forces. It is completely illegal, null and void. https://t.co/rbsvxG64aT",54,225,MFA_China
2022-09-01T23:53:02Z,"Each public health emergency, like a diagnostic scanner, highlights the deep-seated systemic racial discrimination in the US. https://t.co/tyqtg0DXuQ",29,115,MFA_China
2022-09-01T23:52:41Z,Hyping up “China threat” and talking about missile development plans &amp; counterstrike capabilities reveals Japan’s ambition to breach the pacifist constitution &amp; embark on its old path of military expansionism again. This calls for international vigilance. https://t.co/HAoEe2PRVZ,42,142,MFA_China
