title,author,date_pub,full_text
Disputes About the “Indo-Pacific” Regional Security Order and China’s Vision of Regional Order,"Foreign Affairs Review , Ge Tengfei ","May 3, 2021","In recent years, countries around the world have been hotly discussing the issue of infrastructure construction in the Indo-Pacific region. This shows that one of the key driving factors that has made the Indo-Pacific geospace a region of international attention is its huge demand for connectivity construction and the investment prospects and opportunities for economic profits this brings. Looking only at the growth of Chinese and U.S. foreign direct investment (stock) in 2019, the total annual growth of U.S. investments was U.S. $158.567 billion, of which growth in the Asia-Pacific region accounted for U.S. $67.23 billion, or 42% of total growth. The total annual growth of Chinese investments was U.S. $216.615 billion, of which the growth in the Asia-Pacific region was U.S. $183.589 billion, accounting for 85% of total growth. In the economic cooperation between China and the United States and the Indo-Pacific countries, infrastructure construction such as transportation accounts for a considerable proportion. Judging from the turnover data of China’s foreign contracted projects in 2019, China’s turnover in India, Indonesia, Singapore, Thailand, Vietnam, and Australia was 2.54 billion, 8.7 billion, 3.55 billion, 2.87 billion, 3.94 billion, and 3.92 billion USD respectively. Among U.S. investments in the Asia-Pacific region in 2019, investment in manufacturing industries such as computers and electronic products, transportation equipment, and electrical equipment components alone reached U.S. $83.576 billion. 40 Infrastructure construction also has a necessary and important significance. The construction of regionness must be based on the establishment of infrastructure that facilitates communication and exchanges within the region. This is also the basic requirement for the region to maintain a sustainable development process. In fact, from the first, the emergence of the concept of “Indo-Pacific” reflected the idea of economic connectivity between the two oceans. Economic connectivity also has important significance for the geopolitico-economic space of the Indo-Pacific. The Indian Ocean and the Pacific Ocean are important transportation routes for the global transport of commodities and raw materials. About two-thirds of global oil transportation and one-third of cargo transportation pass through trade routes in the Indian Ocean and the Pacific Ocean. The Indo-Pacific region has clearly become a hub connecting East Asian production centers with key energy sources along the Indian Ocean coast. 41"
Disputes About the “Indo-Pacific” Regional Security Order and China’s Vision of Regional Order,"Foreign Affairs Review , Ge Tengfei ","May 3, 2021","It is precisely based on the growing contradiction between the current level of connectivity infrastructure in the Indo-Pacific region and its massive connectivity status and demand in the world economy that the issue of connectivity infrastructure construction has been quickly put on the agenda of Indo-Pacific countries since the beginning of the 21st century. Transportation infrastructure remains the focus of cooperation among all parties, and transportation infrastructure projects represented by modern railway networks, highway networks, automated ports, and airports are key areas receiving support and attention from all parties. In October 2010, ASEAN announced its Master Plan on ASEAN Connectivity, which proposed an ASEAN connectivity plan including infrastructure. In September and October 2013, China proposed the “Belt and Road” initiative, a significantly more ambitious interconnected infrastructure project focused on the Indo-Pacific region. China has also proposed the establishment of the Asian Infrastructure Investment Bank, which is committed to promoting infrastructure construction and connectivity in Asia. Around 2012, several senior officials of the U.S. State Department, including then-Secretary of State Hillary Clinton, also proposed the idea of building an “Indo-Pacific Economic Corridor,” hoping to establish a South Asia-Southeast Asia economic connectivity network with India at the core. In 2015, U.S. President Barack Obama and the Indian government jointly issued the Joint Strategic Vision, emphasizing the importance of political and infrastructure connectivity: “To support regional economic integration, we will promote accelerated infrastructure connectivity and economic development in a manner that links South, Southeast and Central Asia.” 42 The U.S. National Security Strategy document released in December 2017 repeatedly emphasized the importance of infrastructure, mentioning infrastructure in 42 places. The document states that, in the Indo-Pacific region, the United States encourages regional cooperation and peaceful settlement of disputes to maintain free and open waterways, transparent infrastructure financing activities, and unhindered trade. It emphasizes cooperation with allies on high-quality infrastructure construction. 43 In 2019, the U.S. State Department published the document A Free and Open Indo-Pacific, which mentions infrastructure in 37 places. 44 At the end of July 2018, the United States also established a trilateral partnership framework with Australia and Japan to jointly build an investment framework for infrastructure development in the Indo-Pacific region and jointly mobilize investment in infrastructure. 45"
Disputes About the “Indo-Pacific” Regional Security Order and China’s Vision of Regional Order,"Foreign Affairs Review , Ge Tengfei ","May 3, 2021","Connectivity construction and infrastructure construction in the Indo-Pacific region have also attracted the attention of major international organizations. The 2014 G20 Summit in Brisbane specifically supported public and private investment in global infrastructure through the Global Infrastructure Initiative and established the Global Infrastructure Hub in Sydney. Since then, the issue of infrastructure construction and investment quality has received sustained attention from international organizations such as the G20, G7, Asia-Pacific Economic Cooperation (APEC), and East Asia Summit. The G7 Ise-Shima Summit held in Japan in May 2016 also proposed five principles for promoting high-quality infrastructure investment, including effective management, promotion of local employment and capacity building, addressing social and environmental consequences, coordinating economic and development strategies, and improving the efficiency of resource use. 46 In September of the same year, the communique of the G20 Summit in Hangzhou, China further emphasized that investment in high-quality infrastructure is based on a combination of lifecycle costs, safety, resilience to natural disasters, job creation, capacity building, and the transfer of knowledge and expertise on mutually agreed terms so as to ensure economic efficiency while addressing the social and environmental impacts of projects and aligning them with economic and development strategies. 47 On September 6, 2016, ASEAN adopted a new version of the Master Plan on ASEAN Connectivity 2025 document in Vientiane, Laos, focusing on five strategic areas including sustainable infrastructure construction, digital innovation, logistics, import and export management, and human mobility. The plan states that, for sustainable infrastructure construction, ASEAN needs at least U.S. $110 billion in infrastructure investment annually to support future growth."
Disputes About the “Indo-Pacific” Regional Security Order and China’s Vision of Regional Order,"Foreign Affairs Review , Ge Tengfei ","May 3, 2021",(iii) Constantly looking for “regionness” beliefs
Disputes About the “Indo-Pacific” Regional Security Order and China’s Vision of Regional Order,"Foreign Affairs Review , Ge Tengfei ","May 3, 2021","The concept of region in international politics constitutes a kind of social existence in international politics. Its formation and establishment depend on the intertwined common beliefs held by international actors. The construction of a regional order is a negotiation process in which a regional community of practice forms shared beliefs, concepts, and norms through practices based on shared background knowledge. This is embodied in a process of constantly seeking and constructing “regionness.” Just as the regional concepts of “Europe,” “the Americas,” “Africa,” “East Asia,” and “Asia-Pacific,” all contain certain characteristic regional beliefs, regional cultures, and regional governance mechanisms, “Indo-Pacific,” as a regional construction, must not be an exception if it is to have long-term prospects. As a new structure, “Indo-Pacific” may not have manifested such things in an obvious way, but the existence of this new structure must have a material basis on which it is built. 48Otherwise, it will be difficult for this new structure to stand the test posed by time and space. The emergence of the Indo-Pacific concept reflects the increasingly close and inseparable economic and political ties between the Indian Ocean and the Pacific Ocean regions, and the increasingly close economic and political connection between the South Asia-Indian Ocean region and East Asia, Southeast Asia, and the Western Pacific region. Geographically, it connects the two strategic regions of the Indian Ocean and the Pacific Ocean and constitutes a strategic channel with great geostrategic value. It can be said that it is the deepening economic and political relationships between the Indian Ocean and the Pacific Ocean that constitute the cognitive basis and material foundation for the creation of the Indo-Pacific concept."
Disputes About the “Indo-Pacific” Regional Security Order and China’s Vision of Regional Order,"Foreign Affairs Review , Ge Tengfei ","May 3, 2021","However, now that the “Indo-Pacific” region has been recognized in international politics, in addition to signifying huge opportunities for economic benefits, more attention should be paid to the regional culture, mechanisms, and order associated with this emerging “region.” The shaping of the “Indo-Pacific region” and the construction of a regional security order must conform to the basic attributes and historical logic connoted by the “regional” order. Taking a long-term view, this includes a set of security mechanisms and security culture dedicated to regional dispute settlement and regional integrity construction, a set of security concepts conducive to regional development and security cooperation, and a set of security governance mechanisms that help resolve regional issues. In fact, the tributary system that China once created in East Asia and its long-term peaceful exchanges with neighboring peoples, the long-standing cultural exchanges between China and South Asia and China and India along with the joint advocacy of the Five Principles of Peaceful Coexistence by China, India, Myanmar, and other countries, and the series of cooperation mechanisms and frameworks among developing countries in the Indian Ocean and the Pacific region all constitute the historical accumulation and practical basis for the construction of the Indo-Pacific order. Major border incidents such as the Doklam standoff in 2017 and the Galwan Valley conflict in June 2020 almost led to conflict between China and India. However, China and India finally relieved the situation through bilateral political negotiations, commander-level talks, and other mechanisms, and the consensus reached by the leaders of the two sides to resolve the border issue peacefully once again withstood a test. To a certain extent, this illustrated the concept of peaceful negotiation and the historical and endogenous nature of the culture of peaceful coexistence among countries in the Indo-Pacific region. It also demonstrates the necessity of constructing a certain Indo-Pacific security order based on this security culture."
Disputes About the “Indo-Pacific” Regional Security Order and China’s Vision of Regional Order,"Foreign Affairs Review , Ge Tengfei ","May 3, 2021",(iv) Possessing a sort of universal significance
Disputes About the “Indo-Pacific” Regional Security Order and China’s Vision of Regional Order,"Foreign Affairs Review , Ge Tengfei ","May 3, 2021","As “region” is a unit level in international politics, its security order construction must conform to a certain trend in international politics and possess certain “normative” connotations. The most important situation facing the construction of a regional security order in the Indo-Pacific today is the management of the competition between the great powers of China and the United States. In the context of the basic situation of great power competition and even confrontation, how to examine and deal with the relationship between the two major regional propositions, namely, security and development, is a historic problem. Obviously, the question is not whether to give priority to security or development because the mandatory option of countries is to prioritize security. Without security, we cannot talk about development, so the development agenda is built upon the assurance of security. Therefore, the real question is, given the premise of prioritizing security, how should countries balance security and development?"
Disputes About the “Indo-Pacific” Regional Security Order and China’s Vision of Regional Order,"Foreign Affairs Review , Ge Tengfei ","May 3, 2021","Further complicating the issue, the establishment of a security order in the Indo-Pacific region involves many countries outside the region. There are naturally differences between the concerns of countries in the region and countries outside the region. Generally speaking, the first thing countries outside the region see is the economic and political rise of the Indo-Pacific region and how this presents opportunities or harm to their own interests. Their primary concern is the positive or negative effect on their own interests, and their policy operations are inherently self-interested and quite speculative. For countries in the region, the regional security order is a basic and necessary public good. It is a combination of self-interest and altruism, with more emphasis on cooperation, common advantage, and mutual benefit. However, whether in terms of power structure or interest structure, the construction of a regional security order for the Indo-Pacific cannot completely exclude the views and demands of countries outside the region. The Indo-Pacific region maintains extreme openness in terms of both geopolitical reality and historical characteristics. 49 Of course, for the countries in the region, guiding the countries from outside the region to exert influence in a way that conforms to the consensus of the countries in the region is particularly important. This, in turn, depends on the formation of unity and consensus in terms of demands by countries in the region. The establishment of a security order in the Indo-Pacific region is in fact the act of solving the problem of the relationship between regional security and development through an open international approach."
Disputes About the “Indo-Pacific” Regional Security Order and China’s Vision of Regional Order,"Foreign Affairs Review , Ge Tengfei ","May 3, 2021",V. China’s Vision for the Indo-Pacific Regional Order
Disputes About the “Indo-Pacific” Regional Security Order and China’s Vision of Regional Order,"Foreign Affairs Review , Ge Tengfei ","May 3, 2021","Chinese officials are skeptical of the “Indo-Pacific” concept and do not advocate or even oppose the use of the Indo-Pacific concept. This reflects China’s political prudence in handling foreign and security affairs. However, this does not mean that China does not participate in the construction of the regional security order. China already participates in and influences the political, economic, and security order development of the Indo-Pacific region by actively creating regional security “relationship networks” and promoting the construction of the “Belt and Road” and “Community with a Shared Future.”"
Disputes About the “Indo-Pacific” Regional Security Order and China’s Vision of Regional Order,"Foreign Affairs Review , Ge Tengfei ","May 3, 2021",(i) Make great efforts to build an inclusive and cooperative regional security “relationship network”
Disputes About the “Indo-Pacific” Regional Security Order and China’s Vision of Regional Order,"Foreign Affairs Review , Ge Tengfei ","May 3, 2021","There are two very different security views in the Indo-Pacific region. One emphasizes power politics, such as hegemonic security and alliance security, which is essentially a self-interested and exclusive security order. The other emphasizes cooperative development, such as cooperative security and development security, and pursues an open security order. The regional security view that China upholds obviously belongs to the latter. As a regional economic power, China craves regional security. This determines that China can only pursue the latter’s essential attributes. To a large extent, the two aforementioned security views also reflect the different sociocultural conceptual structures of the international community. Alexander Wendt defined three international social structures with different cultural ideas, namely the Hobbesian, Lockean, and Kantian cultures of anarchy. 50 The Hobbesian culture is a culture that emphasizes struggle and confrontation, the Lockean culture implies the pursuit of a certain cooperative social relationship, and the Kantian culture hopes to achieve a permanent peace, a peaceful alliance that ends all wars. 51 In fact, because the East Asian region has inherited a cultural tradition of harmony guided by Chinese culture, it has formed a harmonious culture that emphasizes cooperation rather than confrontation. This is a shared cultural structure located between the Lockean and Kantian cultures. “In Chinese culture, the practical activities of farming society are the life foundation of this cultural body. As a result, more emphasis is placed on groups, more emphasis is placed on the relationships between group members, and more emphasis is placed on harmony between people and between people and nature, so that relationships becomes the core concept.” 52The core content of the ASEAN approach is also consensus, emphasis on national comfort, and non-interference in internal affairs. 53 Qin Yaqing pointed out that “‘Comfort’ is a unique norm for cooperation in East Asia. It serves as a key glue throughout the entire process of cooperation, preventing a relationship breakdown between the participating parties. Even in the most difficult times of cooperation, at the minimum, it allows the relationship to be maintained so that the cooperation process can continue into the future.” 54"
Disputes About the “Indo-Pacific” Regional Security Order and China’s Vision of Regional Order,"Foreign Affairs Review , Ge Tengfei ","May 3, 2021","In the regional security order, as represented by China, this sort of sociocultural structure that values harmony naturally leads to a cooperative security view, which opposes hegemony and the willful use of force in confrontation, opposes realist power security, group-based security, and geopolitical confrontation, and even opposes polarization. It supports collaboration and coordination among major powers, emphasizing mutual respect, mutual trust, equal treatment, and mutual benefit among countries. At the practical level, China has always shown an inclusive attitude, and does not oppose but instead welcomes foreign countries to participate in the construction of the regional security order. Moreover, in line with the position of seeking common ground while shelving differences, and enhancing trust, and dispelling doubts, China is committed to resolving confrontational intentions with an inclusive attitude, so as to achieve the goals of harmonious efforts and common development."
Disputes About the “Indo-Pacific” Regional Security Order and China’s Vision of Regional Order,"Foreign Affairs Review , Ge Tengfei ","May 3, 2021","Adhering to the basic concept of harmonious cooperation, China is committed to building various “relationship networks” with rich significance with many countries from the Pacific Ocean to the Indian Ocean. Since the beginning of the 21st century, China has successively proposed friendly neighbor relations with surrounding countries based on “good neighborliness, security, and prosperity”; a “new type of major-country relationship” of “non-conflict, non-confrontation, mutual respect, and win-win cooperation” and “Community of Common Destiny” relationship (Laos, Cambodia, Myanmar); “a comprehensive partnership that keeps pace with the times” (Singapore); “a closer development partnership” (India); “a comprehensive partnership of good-neighborliness, mutual trust, and mutual benefit” (Timor-Leste); a “sincere mutual aid and friendship from generation to generation strategic partnership” (Sri Lanka); “strategic partnership for peace and development and friendship from generation to generation” (Nepal); a partnership for “common development, commitment to regional peace, joint revitalization of Asia, and promotion of world prosperity” (Korea); as well as comprehensive strategic partnerships with Vietnam and Thailand, comprehensive strategic partnerships with Malaysia and Indonesia, and strategic partnerships with Bangladesh and Brunei. China co-founded the Shanghai Cooperation Organization and actively participated in regional security organizations such as the East Asia Summit, the ASEAN Regional Forum, the CICA, the Asian Cooperation Dialogue, the Indian Ocean Rim Association, and the South Asian Association for Regional Cooperation, constructing an operation mode of security relations with bilateral strategic partnerships as the mainstay, supplemented by multilateral mechanisms, and with unique Chinese cultural characteristics. As the central country in East Asia, China maintains peripheral security, promotes regional peace, actively advocates regional security cooperation and peaceful development, and is committed to repairing the nearly broken great power relationship between China and the United States. All of this demonstrates China’s unremitting efforts to build a regional security order."
Disputes About the “Indo-Pacific” Regional Security Order and China’s Vision of Regional Order,"Foreign Affairs Review , Ge Tengfei ","May 3, 2021",(ii) Strive to build a community with a shared future that is conducive to sustainable regional development
Disputes About the “Indo-Pacific” Regional Security Order and China’s Vision of Regional Order,"Foreign Affairs Review , Ge Tengfei ","May 3, 2021","China believes that common development is the fundamental way to resolve regional security issues. The 2017 Chinese government white paper pointed out that expanding the integration of economic interests is an important foundation for relations between countries, and achieving common development is the fundamental assurance for maintaining peace and stability. It is the “master key” for solving various security issues. 55 The current political and security order in the Indo-Pacific region is in the process of repeated confrontations of various political positions and views. The United States’ promotion of strategic competition with China has led to intensified disputes over the regional security order in the Indo-Pacific. In addition, the COVID-19 pandemic has seriously damaged the economic development of various countries. The methods by which to restore economic growth as soon as possible, relieve difficulties, resolve confrontation, and seek to strengthen multilateral cooperation have become the priorities of governments and people in the region, including China."
Disputes About the “Indo-Pacific” Regional Security Order and China’s Vision of Regional Order,"Foreign Affairs Review , Ge Tengfei ","May 3, 2021","Chinese leaders have openly advocated “to create a security pattern that is fair and just, with joint construction and sharing,” “to promote the simultaneous advance of international cooperation in the economic and social fields, coordinate responses to traditional and non-traditional security threats, and prevent the scourge of war before it occurs.” 56 An important historical lesson of China’s economic development and rise is to strive to create a stable domestic social and political environment as well as a favorable surrounding and international environment. At the same time, economic and social development feeds back to promote domestic security and peripheral security. China insists on resolving domestic social conflicts through development. In dealing with some peripheral sovereignty disputes, such as the Diaoyu Islands issue and the South China Sea dispute, China also adheres to the policy of shelving disputes and pursuing joint development. The preference for development in China’s domestic and foreign policies has become the basic path and method for China to participate in world affairs and to build and promote peripheral security, regional security, and international security."
